Title,Status,Publish Date,Author,Categories,Excerpt,Featured,Legacy HTML,Legacy Webflow ID,Masthead Dark Overlay,Masthead Image,Meta Description,Meta Title,OG Image,Photo Credit,Related Articles,Slug,Thumbnail Image,Old Categories
Chapter 5 - Collaborating Effectively in a Headless Environment,Published,"August 21, 2024 5:00 PM (PDT)",J.P. Holecka (https://app.notion.com/p/J-P-Holecka-37db37adcd5b81fda1abff160a375857?pvs=21),Build,"Discover strategies for fostering effective collaboration in a headless CMS environment, ensuring seamless teamwork and streamlined workflows with Contentful and Sanity.",No,"<h2 id="""">Collaborating Effectively in a Headless CMS Environment</h2><p id="""">The transition to a headless CMS like Contentful or Sanity represents more than just a change in technology—it requires a fundamental shift in how teams collaborate. In a headless environment, content, design, and development teams must work more closely than ever to deliver cohesive and consistent digital experiences. However, this increased collaboration can present challenges if not managed effectively.</p><p id="""">In this post, we’ll explore strategies for fostering effective collaboration in a headless CMS environment, ensuring that your teams are aligned, your workflows are streamlined, and your content is delivered seamlessly across all channels.</p><h3 id="""">The Collaboration Challenge in a Headless Environment</h3><p id="""">A headless CMS separates content creation from its presentation, which offers unparalleled flexibility. But with this flexibility comes the need for tighter collaboration among teams that may not have previously worked closely together. Content creators, designers, and developers each have their own workflows and priorities, and without proper coordination, these can easily clash, leading to inefficiencies and miscommunication.</p><h3 id="""">Strategies for Effective Collaboration<strong id="""">‍</strong></h3><p id=""""><strong id="""">1. Establish Clear Roles and Responsibilities:</strong> In a headless CMS environment, it’s essential to clearly define the roles and responsibilities of each team member. Content creators need to understand how their work will be used across different platforms, while developers need to be aware of the content’s structure and requirements. By defining these roles upfront, you can ensure that everyone knows what is expected of them and how their work contributes to the overall project.<strong id="""">‍</strong></p><p id=""""><strong id="""">2. Create a Unified Workflow:</strong> A headless CMS requires a more integrated workflow that brings together content, design, and development processes. Tools like Jira, Trello, or Asana can help manage tasks and keep everyone on the same page. Consider creating a unified workflow that outlines each stage of content creation, from initial concept to final deployment, with clear checkpoints for collaboration and feedback.<strong id="""">‍</strong></p><p id=""""><strong id="""">3. Foster Open Communication Channels:</strong> Effective communication is the backbone of successful collaboration. Encourage regular check-ins and open communication channels between teams to ensure that any issues or concerns are addressed promptly. Tools like Slack or Microsoft Teams can facilitate real-time communication and help bridge any gaps between content creators, designers, and developers.<strong id="""">‍</strong></p><p id=""""><strong id="""">4. Implement a Centralized Content Hub:</strong> A centralized content hub can serve as a single source of truth for all your content assets. This hub should be accessible to all team members and contain everything from content briefs and guidelines to design assets and code snippets. By centralizing your content, you can ensure that everyone is working from the same set of materials, reducing the risk of inconsistencies and errors.<strong id="""">‍</strong></p><p id=""""><strong id="""">5. Use Design Systems and Component Libraries:</strong> Design systems and component libraries are invaluable in a headless CMS environment. These resources provide a consistent set of design elements and components that can be reused across different platforms and projects. By using a design system, designers and developers can ensure that their work is aligned, reducing the need for back-and-forth adjustments and ensuring a consistent user experience.<strong id="""">‍</strong></p><p id=""""><strong id="""">6. Leverage Real-Time Collaboration Tools:</strong> Platforms like Contentful and Sanity offer real-time collaboration features that allow multiple team members to work on the same content simultaneously. This can be especially useful for content reviews and approvals, as it enables instant feedback and reduces delays. Make full use of these tools to streamline the collaboration process and keep your projects on track.<strong id="""">‍</strong></p><p id=""""><strong id="""">7. Regularly Review and Optimize Workflows:</strong> Collaboration is an ongoing process that requires continuous refinement. Regularly review your workflows to identify any bottlenecks or inefficiencies, and be open to making adjustments as needed. Gather feedback from your teams on what’s working well and what could be improved, and use this information to optimize your collaboration processes.</p><h3 id="""">Real-World Example: Collaboration with Contentful and Sanity</h3><p id="""">Both Contentful and Sanity offer features designed to enhance collaboration. Contentful’s role-based permissions and workflows make it easy to manage who can create, edit, and publish content, ensuring that the right people are involved at the right stages. Sanity’s real-time editing and collaboration tools enable teams to work together seamlessly, whether they’re in the same office or distributed around the globe.</p><p id="""">By leveraging these features, you can create a more collaborative environment that supports the efficient delivery of content across all your digital platforms.</p><p id="""">Struggling with collaboration in your headless CMS? Download our comprehensive ebook for more tips and strategies on how to streamline your workflows with Contentful and Sanity</p><p id="""">‍<br><a href=""http://www.powershifter.com/blog/structuring-your-content-for-maximum-flexibility""><strong id="""">&lt;&lt;Chapter 4: Structuring Your Content for Maximum Flexibility </strong></a></p><p id=""""><a href=""http://www.powershifter.com/blog/enhancing-user-experience-with-headless-cms""><strong id="""">Chapter 6: Enhancing User Experience with Headless CMS&gt;&gt;</strong></a></p><p id="""">‍</p><figure id="""" class=""w-richtext-figure-type-image w-richtext-align-fullwidth"" style=""max-width:1280px"" data-rt-type=""image"" data-rt-align=""fullwidth"" data-rt-max-width=""1280px""><a id="""" href=""https://www.powershifter.com/blog/headless-cms-help-ebook#ebook"" target=""_blank""><div id=""""><img id="""" alt=""__wf_reserved_inherit"" src=""https://uploads-ssl.webflow.com/62a638e43312dd558c19617f/66c75edf3cddc419997ba011_66c75eb3ac1dce4aa7db0156_663279e947c61b40f9e5d33b_Headless%2520ebook%2520Banner%2520.png"" width=""auto"" height=""auto"" loading=""lazy""></div></a></figure>",66c8f120be8ec8ffe9e948b2,No,https://imagedelivery.net/So76NP_fFT3s9jNLvxCRFw/42363800-2ae9-4c01-569c-8cf58a09e900/public,"Chapter 5: going headless changes how teams work. Strategies for keeping content, design, and development in sync with Contentful or Sanity.",Collaborating Effectively in a Headless Environment,https://imagedelivery.net/So76NP_fFT3s9jNLvxCRFw/615a75c7-2a9e-426a-a225-d47d49275400/public,,"Everything’s Gone Headless — Is Your Organization Ready? (https://app.notion.com/p/Everything-s-Gone-Headless-Is-Your-Organization-Ready-37db37adcd5b81eaa3d2d45ee5d4817d?pvs=21), Top 10 Mistakes People Make When Moving to a Headless CMS & A Comprehensive Guide To Avoiding Them (https://app.notion.com/p/Top-10-Mistakes-People-Make-When-Moving-to-a-Headless-CMS-A-Comprehensive-Guide-To-Avoiding-Them-37db37adcd5b812fa3f3ccd646c89579?pvs=21)",collaborating-effectively-in-a-headless-environment,https://imagedelivery.net/So76NP_fFT3s9jNLvxCRFw/615a75c7-2a9e-426a-a225-d47d49275400/public,"Technology Development (https://app.notion.com/p/Technology-Development-37db37adcd5b810d82f1cd7038016629?pvs=21), Headless CMS (https://app.notion.com/p/Headless-CMS-37db37adcd5b814688f5d632a41432e4?pvs=21), Founder's Focus (https://app.notion.com/p/Founder-s-Focus-37db37adcd5b81eabe3ef472c08031c6?pvs=21)"
Chapter 4 - Structuring Your Content for Maximum Flexibility,Published,"August 21, 2024 5:00 PM (PDT)",J.P. Holecka (https://app.notion.com/p/J-P-Holecka-37db37adcd5b81fda1abff160a375857?pvs=21),Build,"Learn how to optimize content delivery using API-driven architecture in headless CMS platforms like Contentful and Sanity for faster, more efficient performance.",No,"<h2 id="""">Structuring Your Content for Maximum Flexibility in Headless CMS</h2><p id="""">One of the most significant advantages of using a headless CMS like Contentful or Sanity is the ability to manage content independently of its presentation. This decoupling allows businesses to deliver consistent and personalized experiences across various platforms. However, to truly harness the power of a headless CMS, it’s crucial to structure your content in a way that maximizes its flexibility and reusability.</p><p id="""">In this post, we’ll explore best practices for content structuring within a headless CMS, ensuring that your content remains adaptable, scalable, and ready to meet the evolving demands of your digital strategy.<strong id="""">‍</strong></p><h3 id="""">The Importance of Content Structure in a Headless CMS</h3><p id="""">In a traditional CMS, content is often intertwined with how it will be displayed, leading to rigid and inflexible systems. In contrast, a headless CMS separates content from its presentation layer, allowing it to be reused across different channels and contexts. However, this flexibility is only possible if the content is structured correctly from the start.</p><h4 id="""">A well-structured content model enables you to:</h4><ul id=""""><li id="""">‍<strong id="""">Reuse content across different platforms and devices without duplication.</strong>‍</li><li id=""""><strong id="""">Adapt to new channels quickly and efficiently as they emerge.</strong></li><li id=""""><strong id="""">Maintain consistency in content delivery, regardless of the presentation medium.</strong></li><li id=""""><strong id="""">Scale your content strategy without needing extensive rework.</strong></li></ul><h3 id="""">Best Practices for Structuring Content</h3><p id=""""><strong id="""">1. Embrace Modular Content Design:</strong> In a headless CMS, content should be modular—broken down into smaller, reusable components rather than large, monolithic blocks. This approach allows you to mix and match content elements to create new content experiences quickly and efficiently. For example, instead of creating a single “blog post” entity that includes the title, body, and images, you might create separate entities for each element, which can then be combined in various ways across different platforms.<strong id="""">‍</strong></p><p id=""""><strong id="""">2. Use Content Types and Fields Wisely:</strong> Content types define the structure of your content, while fields within those types store specific pieces of data. In a headless CMS, it’s important to design your content types and fiy. For instance, if you frequently update product descriptions or pricing information, these should be stored as separate fields that can be easily updated and reused across multiple pages or platforms.<strong id="""">‍</strong></p><p id=""""><strong id="""">3. Plan for Localization and Personalization:</strong> If your content needs to be delivered in multiple languages or tailored to different audience segments, your content structure should accommodate these requirements froelds to ensure flexibility carefullm the outset. Use fields that allow for easy localization and consider how personalization might be applied at scale. For example, you might create separate content fields for each language or use dynamic content to tailor messaging based on user data.<strong id="""">‍</strong></p><p id=""""><strong id="""">4. Establish Clear Naming Conventions:</strong> Consistency is key when structuring content in a headless CMS. Establishing clear naming conventions for content types, fields, and entities will make it easier for your team to manage and update content over time. For example, use descriptive names that reflect the content’s purpose, such as “ArticleTitle” or “ProductImage,” rather than generic terms like “Title” or “Image.”<strong id="""">‍</strong></p><p id=""""><strong id="""">5. Incorporate Metadata for Enhanced Searchability:</strong> Metadata plays a crucial role in content management, especially in a headless CMS. By tagging your content with relevant metadata, you can enhance its searchability, making it easier for your team to find and repurpose content as needed. Metadata can also be used to power dynamic content delivery, ensuring that the right content is presented to the right audience at the right time.<strong id="""">‍</strong></p><p id=""""><strong id="""">6. Test and Iterate Your Content Model:</strong> No content model is perfect from the start. As you begin using your headless CMS, you may discover that certain content types or fields need to be adjusted to better meet your needs. Regularly review and iterate your content model based on feedback from your team and real-world usage. This iterative approach ensures that your content structure remains flexible and effective as your digital strategy evolves.<strong id="""">‍</strong></p><h3 id="""">Real-World Example: Content Structuring with Contentful and Sanity</h3><p id="""">Both Contentful and Sanity offer powerful tools for content structuring. Contentful’s content model is highly customizable, allowing you to define content types and fields that precisely match your needs. Sanity takes this a step further with its schema-driven approach, enabling developers to define content structures in code, which can then be easily versioned and updated as requirements change.</p><p id="""">By leveraging these tools, you can create a content structure that not only meets your current needs but is also adaptable to future demands.</p><p id="""">‍<br><a href=""http://www.powershifter.com/blog/optimizing-content-delivery-with-api-driven-architecture""><strong id="""">&lt;&lt;Chapter 3: Optimizing Content Delivery with API-Driven Architecture</strong></a></p><p id=""""><a href=""http://www.powershifter.com/blog/collaborating-effectively-in-a-headless-environment""><strong id="""">Chapter 5: Collaborating Effectively in a Headless Environment&gt;&gt;</strong></a></p><p id="""">‍</p><figure id="""" class=""w-richtext-figure-type-image w-richtext-align-fullwidth"" style=""max-width:1280px"" data-rt-type=""image"" data-rt-align=""fullwidth"" data-rt-max-width=""1280px""><a id="""" href=""https://www.powershifter.com/blog/headless-cms-help-ebook#ebook"" target=""_blank""><div id=""""><img id="""" alt=""__wf_reserved_inherit"" src=""https://uploads-ssl.webflow.com/62a638e43312dd558c19617f/66c75edf3cddc419997ba011_66c75eb3ac1dce4aa7db0156_663279e947c61b40f9e5d33b_Headless%2520ebook%2520Banner%2520.png"" width=""auto"" height=""auto"" loading=""lazy""></div></a></figure>",66c8ee863c8f49e9bb1a40e8,No,https://imagedelivery.net/So76NP_fFT3s9jNLvxCRFw/42363800-2ae9-4c01-569c-8cf58a09e900/public,Chapter 4: how to structure content in a headless CMS like Contentful or Sanity so it stays reusable and adaptable across every platform you publish to.,Structuring Headless CMS Content for Flexibility,https://imagedelivery.net/So76NP_fFT3s9jNLvxCRFw/b09196e5-4190-4411-5400-b88026a7ab00/public,,"Everything’s Gone Headless — Is Your Organization Ready? (https://app.notion.com/p/Everything-s-Gone-Headless-Is-Your-Organization-Ready-37db37adcd5b81eaa3d2d45ee5d4817d?pvs=21), Top 10 Mistakes People Make When Moving to a Headless CMS & A Comprehensive Guide To Avoiding Them (https://app.notion.com/p/Top-10-Mistakes-People-Make-When-Moving-to-a-Headless-CMS-A-Comprehensive-Guide-To-Avoiding-Them-37db37adcd5b812fa3f3ccd646c89579?pvs=21)",structuring-your-content-for-maximum-flexibility,https://imagedelivery.net/So76NP_fFT3s9jNLvxCRFw/b09196e5-4190-4411-5400-b88026a7ab00/public,"Technology Development (https://app.notion.com/p/Technology-Development-37db37adcd5b810d82f1cd7038016629?pvs=21), Headless CMS (https://app.notion.com/p/Headless-CMS-37db37adcd5b814688f5d632a41432e4?pvs=21), Founder's Focus (https://app.notion.com/p/Founder-s-Focus-37db37adcd5b81eabe3ef472c08031c6?pvs=21)"
Chapter 3 - Optimizing Content Delivery with API-Driven Architecture,Published,"August 21, 2024 5:00 PM (PDT)",J.P. Holecka (https://app.notion.com/p/J-P-Holecka-37db37adcd5b81fda1abff160a375857?pvs=21),Build,"Learn how to optimize content delivery using API-driven architecture in headless CMS platforms like Contentful and Sanity for faster, more efficient performance.",No,"<h2 id="""">Optimizing Content Delivery with API-Driven Architecture in Headless CMS</h2><p id="""">As businesses continue to expand their digital presence across various platforms, the importance of efficient content delivery has never been greater. In a headless CMS environment, where the frontend and backend are decoupled, APIs play a crucial role in ensuring that content is delivered quickly and accurately to the right channels.</p><p id="""">However, while APIs offer unparalleled flexibility, they can also introduce new challenges if not properly managed. In this post, we’ll explore how to optimize content delivery using API-driven architecture in headless CMS platforms like Contentful and Sanity, ensuring that your content reaches its audience efficiently and without hiccups.</p><h3 id="""">Understanding API-Driven Architecture</h3><p id="""">At the heart of any headless CMS is the API (Application Programming Interface). An API acts as a bridge between your content repository and various front-end platforms, enabling content to be fetched and displayed dynamically. This architecture allows you to manage your content centrally and distribute it across multiple channels—websites, mobile apps, digital signage, and more.</p><p id="""">APIs in a headless CMS are typically RESTful, meaning they adhere to a set of constraints that make them scalable and easy to interact with. Content is stored as structured data in the CMS and is retrieved by API calls made by the frontend. This process allows for the rapid delivery of content tailored to the needs of each specific platform.</p><h3 id="""">The Importance of API Optimization</h3><p id="""">While APIs provide the flexibility needed to deliver content across different platforms, they can also become a bottleneck if not optimized. Poorly managed APIs can lead to slow load times, increased server costs, and a frustrating user experience—negatively impacting your SEO and overall digital strategy.</p><h3 id="""">Tips for Optimizing API-Driven Content Delivery</h3><p id=""""><strong id="""">1. Implement Caching Strategies:</strong> Caching is one of the most effective ways to reduce the load on your API and speed up content delivery. By storing a version of frequently requested content closer to the user (for example, through a CDN), you can minimize the need to make repeated API calls. This not only improves performance but also reduces the strain on your servers.<strong id="""">‍</strong></p><p id=""""><strong id="""">2. Use Pagination and Query Optimization:</strong> When dealing with large datasets, it’s important to avoid returning unnecessary data in your API responses. Implement pagination to break down large datasets into manageable chunks, and optimize your queries to fetch only the data you need. This reduces the amount of data transferred and speeds up the response time.<strong id="""">‍</strong></p><p id=""""><strong id="""">3. Monitor API Performance:</strong> Regular monitoring of your API’s performance is crucial to maintaining an efficient content delivery system. Use monitoring tools to track API response times, error rates, and usage patterns. This data will help you identify bottlenecks and areas for improvement, ensuring that your API continues to perform well under varying loads.</p><p id=""""><strong id="""">4. Leverage Content Delivery Networks (CDNs):</strong> A CDN is a network of servers distributed globally that deliver content to users based on their geographic location. By integrating a CDN with your headless CMS, you can ensure that your content is delivered quickly to users regardless of where they are in the world. CDNs work particularly well with API-driven architectures by caching API responses and serving them to users with minimal latency.<strong id="""">‍</strong></p><p id=""""><strong id="""">5. Secure Your API:</strong> Security is a critical aspect of API management. Ensure that your APIs are protected against unauthorized access and vulnerabilities by implementing authentication, encryption, and rate limiting. This not only protects your data but also ensures that your API remains available and performant.<strong id="""">‍</strong></p><p id=""""><strong id="""">6. Optimize for Mobile:</strong> Given the increasing importance of mobile, it’s essential to ensure that your API is optimized for mobile devices. This includes minimizing data payloads, reducing the number of API calls needed to render a page, and ensuring that your API can handle intermittent network connections effectively.</p><h3 id="""">Real-World Example: Optimizing with Contentful and Sanity</h3><p id="""">Both Contentful and Sanity offer robust APIs designed for high performance and flexibility. For example, Contentful’s API allows for powerful querying with GraphQL, enabling developers to fetch only the data they need in a single request. Sanity, on the other hand, provides real-time content updates via its GROQ query language, which is optimized for speed and efficiency.</p><p id="""">By leveraging the built-in tools and best practices provided by these platforms, you can ensure that your content delivery is not only fast and reliable but also scalable as your digital presence grows.</p><p id="""">Want to ensure your API-driven content delivery is optimized for success? Download our free ebook for an in-depth guide on mastering headless CMS with Contentful and Sanity.&nbsp;<br><br></p><p id=""""><a href=""http://www.powershifter.com/blog/common-pitfalls-in-migrating-to-headless-cms""><strong id="""">&lt;&lt;Chapter 2: Common Pitfalls in Migrating to Headless CMS </strong></a></p><p id=""""><a href=""http://www.powershifter.com/blog/structuring-your-content-for-maximum-flexibility""><strong id="""">Chapter 4: Structuring Your Content for Maximum Flexibility&gt;&gt;</strong></a></p><p id="""">‍</p><figure id="""" class=""w-richtext-figure-type-image w-richtext-align-fullwidth"" style=""max-width:1280px"" data-rt-type=""image"" data-rt-align=""fullwidth"" data-rt-max-width=""1280px""><a id="""" href=""https://www.powershifter.com/blog/headless-cms-help-ebook#ebook"" target=""_blank""><div id=""""><img id="""" alt=""__wf_reserved_inherit"" src=""https://uploads-ssl.webflow.com/62a638e43312dd558c19617f/66c75edf3cddc419997ba011_66c75eb3ac1dce4aa7db0156_663279e947c61b40f9e5d33b_Headless%2520ebook%2520Banner%2520.png"" width=""auto"" height=""auto"" loading=""lazy""></div></a></figure>",66c8ecf314daf6206d432792,No,https://imagedelivery.net/So76NP_fFT3s9jNLvxCRFw/42363800-2ae9-4c01-569c-8cf58a09e900/public,"Chapter 3: how API-driven architecture speeds content delivery in a headless CMS like Contentful or Sanity—for faster, more efficient performance.",Optimizing Content Delivery with API-Driven Architecture,https://imagedelivery.net/So76NP_fFT3s9jNLvxCRFw/d8751a6c-31df-43bd-0b48-ba30fc953f00/public,,"Everything’s Gone Headless — Is Your Organization Ready? (https://app.notion.com/p/Everything-s-Gone-Headless-Is-Your-Organization-Ready-37db37adcd5b81eaa3d2d45ee5d4817d?pvs=21), Top 10 Mistakes People Make When Moving to a Headless CMS & A Comprehensive Guide To Avoiding Them (https://app.notion.com/p/Top-10-Mistakes-People-Make-When-Moving-to-a-Headless-CMS-A-Comprehensive-Guide-To-Avoiding-Them-37db37adcd5b812fa3f3ccd646c89579?pvs=21)",optimizing-content-delivery-with-api-driven-architecture,https://imagedelivery.net/So76NP_fFT3s9jNLvxCRFw/d8751a6c-31df-43bd-0b48-ba30fc953f00/public,"Technology Development (https://app.notion.com/p/Technology-Development-37db37adcd5b810d82f1cd7038016629?pvs=21), Headless CMS (https://app.notion.com/p/Headless-CMS-37db37adcd5b814688f5d632a41432e4?pvs=21), Founder's Focus (https://app.notion.com/p/Founder-s-Focus-37db37adcd5b81eabe3ef472c08031c6?pvs=21)"
