Title,Status,Publish Date,Author,Categories,Excerpt,Featured,Legacy HTML,Legacy Webflow ID,Masthead Dark Overlay,Masthead Image,Meta Description,Meta Title,OG Image,Photo Credit,Related Articles,Slug,Thumbnail Image,Old Categories
Product Design Insights: Seven Great Reads for September,Draft,"September 14, 2020 5:00 PM (PDT)",J.P. Holecka (https://app.notion.com/p/J-P-Holecka-37db37adcd5b81fda1abff160a375857?pvs=21),Build,A curated selection of our team's recommended digital product reads.,No,"<p id="""">This month, our experts have been reading about the importance of accessibility, how much people remember about products, low code-no code predictions, and what we've lost in the push to agile software development. Happy reading!</p><h2 id="""">A collection of design systems for Figma from all over the globe</h2><p id=""""><strong id="""">Category: Product Design</strong></p><p id=""""><em id="""">Recommended by: Gord Brown, Senior Designer</em></p><p id="""">Figma, a platform that helps teams create, test, and ship better designs from start to finish, has exploded in popularity. As enthusiastic users of the tool, we were excited to see how many other well-known companies also use it. <a id="""" href=""https://designsystemsforfigma.com/"">This collection</a> provides real-world Design System resources from some of the biggest companies from around the world. </p><h2 id="""">People remember less of your product than you think</h2><p id=""""><strong id="""">Category: Product Branding</strong></p><p id=""""><em id="""">Recommended by: Priscilla Ho, Lead UX Designer</em></p><p id="""">Products exist to support people in accomplishing a task. If the user succeeds, the app has an increased chance of continued use and remaining in people’s memory. To test how much individuals really remember about products, the author <a id="""" href=""https://uxdesign.cc/people-remember-less-of-your-product-than-you-think-4c1ddbe27b21"">conducted an experiment</a> using Uber. The findings? “A good product provides people with the right clues for using the right memories in order to finish their goal,” said researcher Teisanu Tudor. “However, even a well-built product, backed up by a powerful brand, is only partially remembered. Hiding clues and assuming people learn and get familiar with the product, due to its success, is a risk and a potential harm to their experience.”</p><h2 id="""">Firebase vs. Vercel (aka Zeit)</h2><p id=""""><strong id="""">Category: Technology</strong></p><p id=""""><em id="""">Recommended by Nathan Marshall, Technical Lead</em></p><p id="""">The options for web hosting technologies have grown over the last two years. Some solutions have made it easier, while some have increased the complexity unnecessarily. We recently did a deep dive into Firebase (<a id="""" href=""/blog/what-is-firebase-and-why-our-engineers-and-clients-are-fired-up-about-it"">read here</a>) and were curious to <a id="""" href=""https://medium.com/better-programming/firebase-vs-vercel-aka-zeit-now-2020-7f5ab18d865f"">learn more about Vercel</a>. Vercel is built on top of AWS Lamda, where they use a chunking strategy to break projects into multiple Cloud functions. This setup explains why they have specific integration templates (such as Next or Gatsby, for example), which helps reduce cold start times. For those looking to integrate with APIs requiring high availability, this setup makes it challenging to do so, making Firebase a stronger contender for hosting Next.js-like apps in 2020.</p><h2 id="""">5 most annoying website features I face as a blind person every single day</h2><p id=""""><strong id="""">Category: Accessibility</strong></p><p id=""""><em id="""">Recommended by: Brendan Betts, Software Developer</em></p><p id="""">Accessibility in software development matters. No one with a disability should be excluded from using or interacting with a product. <a id="""" href=""https://bighack.org/5-most-annoying-website-features-i-face-as-a-blind-screen-reader-user-accessibility/"">This article</a> provides a firsthand account of the five most inaccessible web elements faced by a blind screen reader user, and how to fix them. “These issues may seem small to sighted users,” said the author, Holly Tuke, “but they’re the difference between me being able to use a website independently or not.”</p><h2 id="""">Is low-code/no-code the future of application development?</h2><p id=""""><strong id="""">Category: Technology</strong></p><p id=""""><em id="""">Recommended by: JP Holecka, CEO, Founder, Product Strategist</em></p><p id="""">We’ve been reading about and watching as the low-code/no-code trend explodes in software development. With the onset of the pandemic and millions of people forced to work from home, low-code tools gained popularity because they gave non-programmers the power to develop business workflow applications without as much assistance. But is it the future of programming? <a id="""" href=""https://www.techrepublic.com/article/is-low-codeno-code-the-future-of-application-development/"">Experts</a> appear to be on the fence.</p><h2 id="""">What we've lost in the push to agile software development, and how to get it back</h2><p id=""""><strong id="""">Category: Process &amp; Design</strong></p><p id=""""><em id="""">Recommended by: Cary Newfeldt, Director of Technology</em></p><p id="""">Most organizations run their projects in an agile fashion and leave the upfront design work to a minimum. Assuming these details will be planned out as the process moves along, many teams miss out on critical architectural, design, documentation, and modelling opportunities. <a id="""" href=""https://www.zdnet.com/article/what-weve-lost-in-the-push-to-agile-software-development/"">This article</a> advocates for a shift in thinking, and recommends four components that should be part of the upfront design process. </p><h2 id="""">How IOT sensors and analytics can make inside air safer in schools and offices</h2><p id=""""><strong id="""">Category: Client News</strong></p><p id=""""><em id="""">Recommended by Trevor Westerlund, Senior Business Development Director</em></p><p id="""">The Internet of Things (IoT) has become ubiquitous and companies all around the world are using devices’ computational power to make impactful change. As organizations develop back to work plans and kids return to school, it has been vital to focus on how a building’s existing infrastructure affects people’s safety. Delta Controls developed their innovative 03 Sensor Hub (with help from POWER SHIFTER), which is now being used to reduce the spread of coronavirus indoors. <a id="""" href=""https://www.techrepublic.com/article/how-iot-sensors-and-analytics-can-make-inside-air-safer-for-schools-and-offices/"">This is only one example</a> of the benefits of integrating digital products into the IoT ecosystem.</p><p id=""""><em id="""">To get these insights delivered straight to your inbox, </em><a id="""" href=""https://click.pstransmit.net/h/y/603EB429506F0841""><em id="""">subscribe</em></a><em id=""""> to our Simply Good Reads newsletter!</em></p>",63d2c4b249c21edd853a20a5,No,https://imagedelivery.net/So76NP_fFT3s9jNLvxCRFw/e6c6f723-97ca-454e-82d1-fddbd1045200/public,"September's reads: why accessibility matters, how much users actually remember, low-code/no-code predictions, and what agile cost us. Team picks.",Product Design Insights: 7 Great Reads for September,https://imagedelivery.net/So76NP_fFT3s9jNLvxCRFw/677e3f9a-a317-43f7-ca4f-5eacf043d600/public,,,product-design-insights-great-reads-for-september,https://imagedelivery.net/So76NP_fFT3s9jNLvxCRFw/677e3f9a-a317-43f7-ca4f-5eacf043d600/public,"Resources (https://app.notion.com/p/Resources-37db37adcd5b813ba75fe6bf61012e8a?pvs=21), Experience Design (https://app.notion.com/p/Experience-Design-37db37adcd5b8188ba20fc3f87aadc25?pvs=21)"
POWER SHIFTER CEO accepted into Forbes Agency Council,Published,"March 1, 2020 4:00 PM (PST)",J.P. Holecka (https://app.notion.com/p/J-P-Holecka-37db37adcd5b81fda1abff160a375857?pvs=21),Founder's Focus,"Forbes Agency Council Is an Invitation-Only Community for Executives in Successful Public Relations, Media Strategy, Creative, and Advertising Agencies",No,"<figure id="""" class=""w-richtext-figure-type-image w-richtext-align-center"" data-rt-type=""image"" data-rt-align=""center""><div id=""""><img id="""" alt=""Header TW"" src=""https://uploads-ssl.webflow.com/62a638e43312dd558c19617f/62b398820a7c5ebb47391841_Header_TW.png"" width=""auto"" height=""auto"" loading=""auto""></div></figure><p id=""""><strong id="""">Vancouver (March 02, 2020),</strong> — JP Holecka, CEO of POWERSHiFTER, a Vancouver based digital product design studio that adds customer value for brands through Service/UX/UI design, mobile, and web development, has been accepted into Forbes Agency Council, an invitation-only community for owners of and executives in successful public relations, media strategy, creative, and advertising agencies.</p><p id="""">JP Holecka was vetted and selected by a review committee based on the depth and diversity of his experience. Criteria for acceptance includes a track record of successfully impacting business growth metrics, as well as personal and professional achievements and honors. </p><p id=""""><em id="""">“We are honored to welcome JP Holecka into the community,”</em> said Scott Gerber, founder of Forbes Councils, the collective that includes Forbes Agency Council. <em id="""">“Our mission with Forbes Councils is to bring together proven leaders from every industry, creating a curated, social capital-driven network that helps every member grow professionally and make an even greater impact on the business world.”</em></p><p id="""">As an accepted member of the Council, JP has access to a variety of exclusive opportunities designed to help him reach peak professional influence. He will connect and collaborate with other respected local leaders in a private forum. JP will also be invited to work with a professional editorial team to share his expert insights in original business articles on Forbes.com, and to contribute to published Q&amp;A panels alongside other experts. &nbsp;</p><p id=""""><em id="""">I am extremely excited to be able to participate in the Forbes Agency Council. Our passionate team lives and breathes product design every single day, and this opportunity will build upon the community work we've built already in the area of User Experience and Product Design for the last 11 years.</em></p><p id="""">JP Holecka, CEO and Founder</p><p id=""""><strong id="""">ABOUT FORBES COUNCILS</strong>Forbes Councils is a collective of invitation-only communities created in partnership with Forbes and the expert community builders who founded Young Entrepreneur Council (YEC). In Forbes Councils, exceptional business owners and leaders come together with the people and resources that can help them thrive.</p><p id="""">For more information about Forbes Agency Council, visit <a id="""" href=""https://forbesagencycouncil.com"">forbesagencycouncil.com</a>. To learn more about Forbes Councils, visit <a id="""" href=""https://forbescouncils.com"">forbescouncils.com</a>.</p><p id=""""><strong id="""">About POWERSHiFTER Digital</strong>POWERSHiFTER is a digital product and service design studio that partners with leading brands &amp; scaleups to produce digital products — applications, mobile apps, and websites — that unlock the greatest amount of value possible for your brand’s digital touch-points. POWERSHiFTER has been named a top Canadian agency in Clutch’s annual list of high-performing service providers as voted by their clients two years running.</p><p id="""">Follow us on <a id="""" href=""https://twitter.com/POWERSHiFTER"">Twitter</a>, <a id="""" href=""https://www.facebook.com/powershifter/"">Facebook</a>, <a id="""" href=""https://www.instagram.com/powershifterdigital/"">Instagram</a>, and <a id="""" href=""https://www.linkedin.com/company/powershifterdigital"">LinkedIn</a>.</p><p id="""">-30-</p><p id="""">Media Enquiries: Fawn Mulcahy Email: fawn@fawnzcreative.com Mobile: &nbsp;604.961.3314</p>",63d2c4b249c21ecada3a2091,No,https://imagedelivery.net/So76NP_fFT3s9jNLvxCRFw/aa901201-29f2-4f14-6c56-194562ac3100/public,"CEO JP Holecka has been accepted into the Forbes Agency Council, an invitation-only community for leaders of top PR, media, creative, and ad agencies.",Power Shifter CEO Joins the Forbes Agency Council,https://imagedelivery.net/So76NP_fFT3s9jNLvxCRFw/aa901201-29f2-4f14-6c56-194562ac3100/public,JP Holecka (https://app.notion.com/p/JP-Holecka-37db37adcd5b8109a480fddfa11fde30?pvs=21),,jp-holecka-accepted-into-forbes-agency-council,https://imagedelivery.net/So76NP_fFT3s9jNLvxCRFw/aa901201-29f2-4f14-6c56-194562ac3100/public,News (https://app.notion.com/p/News-37db37adcd5b81409937e2e26c5f0955?pvs=21)
POWER SHIFTER CEO Elected to the ICA’s Board of Directors,Published,"August 31, 2020 5:00 PM (PDT)",J.P. Holecka (https://app.notion.com/p/J-P-Holecka-37db37adcd5b81fda1abff160a375857?pvs=21),Founder's Focus,The ICA represents the latest and most influential businesses in Canada.,No,"<p id=""""><strong id="""">(Vancouver, BC)</strong> - JP Holecka, CEO of POWER SHIFTER, a Vancouver based digital product design studio that adds customer value for brands through Service/UX/UI design, mobile, and web development, has been elected to the Institute of Communication Agencies’ (ICA) Board of Directors. </p><p id="""">The ICA has always represented the latest and most influential businesses in Canada. Serving as the largest source of information, education, advocacy, and training for advertising, marketing, media, and public relations agencies, JP’s involvement will broaden the scope to include digital groups.</p><p id="""">In addition to serving as a representative and advocate for digital agencies and businesses on the West Coast, JP will also work with the ICA to bring a digital lens to the association. As the entire country undergoes a digital transformation, JP will lean on his expertise to guide the ICA in this process.</p><p id="""">*“I am extremely excited to become a member of the longstanding ICA. Our passionate team lives and breathes digital product design every single day, and this opportunity will allow us to elevate other digital agencies and groups across the country.” *</p><p id="""">JP Holecka, CEO and Founder.</p><p id=""""><strong id="""">ABOUT THE ICA</strong>Since 1905 the <a id="""" href=""https://theica.ca/about"">ICA</a> has been the not-for-profit association that supports and represents the Canadian advertising, marketing, media and public relations agencies. Our mission is to Amplify, Protect and Transform the agency sector through advocacy, awards, community, consultancy, insight, networking, research and training. Our membership and board of directors represent some of the most recognized and influential businesses in our industry, both in Canada and internationally.</p><p id=""""><strong id="""">ABOUT POWER SHIFTER</strong> Digital POWER SHIFTER is a digital product and service design studio that partners with &nbsp; leading brands &amp; scaleups to produce digital products — applications, mobile apps, and websites — that unlock the greatest amount of value possible for your brand’s digital touch-points. POWER SHIFTER has been named a top Canadian agency in Clutch’s annual list of high-performing service providers as voted by their clients two years running.</p><p id="""">Follow us on <a id="""" href=""https://twitter.com/POWERSHiFTER"">Twitter</a>, <a id="""" href=""https://www.facebook.com/powershifter"">Facebook</a>, <a id="""" href=""https://www.instagram.com/powershifterdigital/"">Instagram</a>, and <a id="""" href=""https://www.linkedin.com/company/powershifterdigital/"">LinkedIn</a>.</p><p id="""">-30-</p><p id="""">Media Enquiries: Fawn Mulcahy Email: fawn@fawnzcreative.com Mobile: 604.961.3314</p>",63d2c4b249c21ebd633a21bb,Yes,https://imagedelivery.net/So76NP_fFT3s9jNLvxCRFw/06cdc753-6232-4712-bf96-0f6888e4be00/public,"CEO JP Holecka has been elected to the board of the Institute of Communication Agencies, which represents Canada's most influential agencies.",Power Shifter CEO Elected to the ICA Board,https://imagedelivery.net/So76NP_fFT3s9jNLvxCRFw/1ee3c052-0ec6-4301-3d60-68591f5ed600/public,,,jp-holecka-elected-to-ica-board-of-directors,https://imagedelivery.net/So76NP_fFT3s9jNLvxCRFw/1ee3c052-0ec6-4301-3d60-68591f5ed600/public,News (https://app.notion.com/p/News-37db37adcd5b81409937e2e26c5f0955?pvs=21)
Unsplash: Disrupting the Stock Photo Industry,Published,"February 1, 2021 4:00 PM (PST)",J.P. Holecka (https://app.notion.com/p/J-P-Holecka-37db37adcd5b81fda1abff160a375857?pvs=21),Founder's Focus,How one company turned a side-of-desk hustle into a multi-layered business model.,No,"<p id="""">Nearly everyone has thought of a potential business at some point in their career. Whether it's a digital product or service, determining how to make a profit can be the most challenging aspect of bringing an idea to fruition. As a product company, we are endlessly fascinated by how organizations craft business models and how those decisions disrupt and shape the future of tech.</p><h2 id="""">Changing business models</h2><p id="""">In 2013, <a id="""" href=""https://unsplash.com/"">Unsplash</a>, a stock photography website, was initially created as a side project by Mikael Cho. The goal was to use the site as a lead generation engine for a marketplace startup called Crew, matching web designers and developers with businesses.</p><p id="""">With no money for marketing, they capitalized on leftover images from photoshoots by giving them away for free and linking back to Crew. ""We were doing these photos for our homepage, we were like, this is still a really crappy process, to try to find good photos that you could very clearly use. So when we did a photoshoot and we had all of these leftovers, we thought, what if we just created that ideal site that we just kept looking for and couldn't find?"" Cho said. </p><p id="""">Unsplash never intended to generate income, yet eight years later, the website is known to almost everyone in digitally creative spaces. While we wouldn't recommend taking Unsplash's monetization path (unless you've got enough financial backing and investor appetite to find a product market fit the hard way) it provides an interesting case study that shows revenue is not always dependent on subscriptions, sponsorships, or in-app purchases.</p><h2 id="""">Unsplash: a case study</h2><h3 id="""">Getting started</h3><p id="""">Mikael and the Crew team purchased the unsplash.com domain for $9, a Tumblr template for $19, and hosted the free stock photos through Dropbox. The idea was to add 10 images a week that would be free to download and share the Unsplash site to other news and design sites to attract others. One of the places that Unsplash was featured was a well-trafficked site called Hacker News. The team thought they would only get a few hundred clicks but after being voted a top story, they had 20,000 people sign up within the first two hours.</p><p id="""">Shortly after launch, Mikael and the team realized they didn’t have the time or money to follow through on the promised release of 10 new high-quality photos a week. To help meet their goal, they outsourced to other photographers who were eager to promote their skills. The idea was a hit, and within the first five months, Unsplash had delivered 1 million high-quality stock photos for free. Less than a year later, that number climbed to 10 million. After reaching 1 million downloads a month, it was time to get serious and find a business model.</p><h3 id="""">A new approach to monetization</h3><p id="""">Unsplash left Tumblr and created their own site that had a search function and an improved user experience. They then started to hunt for a business model, all while running the original marketplace startup at the same time. While they were growing with no business model, they disrupted the very lucrative stock photo business on the whole. Photographers and image sites that normally charge handsomely for their photos were losing market share to Unplash's free high-quality images. Charging for photos would have been counter to the concept, and so the search started to find other sides of the marketplace that would generate revenue.</p><p id="""">After selling the Crew marketplace in 2017, they focused their efforts solely on monetization and landed on three models to generate revenue. </p><p id=""""><strong id=""""><em id="""">1. Unsplash for Brands</em></strong></p><p id="""">The model is that when users search for images of laptops or offices etc., there are professionally shot options available with brands like Microsoft and Google, tastefully put into the photos as product placement. Advertisers whose products are being used can track downloads via a blockchain token to catalog the number of impressions their image receives.</p><p id="""">""By making images available for open use, Unsplash has become the primary source for visuals on the internet. Images on Unsplash are regularly seen more than the frontpage of The New York Times,” said <a id="""" href=""https://unsplash.com/brands"">Unsplash for Brands</a>. “Unsplash puts your content in the hands of people, the creators of the internet. They add context by sharing your visuals with their audiences.""</p><p id=""""><strong id=""""><em id="""">2. Partners</em></strong></p><p id="""">The Partners product provides creative and marketing hubs like Mailchimp, Google Slides, Sticker Mule, and many others with the ability to provide their users with access to Unsplash photos for use inside their platforms. The Partner product fees are generated by charging the Unsplash partners to use their photo library API.</p><p id=""""><strong id=""""><em id="""">3. Unsplash Hire</em></strong></p><p id="""">The most recent endeavor is called Unsplash Hire, a marketplace to source visual creators and storytellers. “ Whether it’s to find the perfect photographer for your event or to create new images for your company’s social media accounts, you can now connect easily on Unsplash,” stated in their <a id="""" href=""https://unsplash.com/blog/unsplash-hire/"">beta announcement</a>.</p><h2 id="""">Breaking the mold</h2><p id="""">Unsplash upended the stock photo industry by meeting the needs of consumers and professionals in a unique way. They built a vast library of high-quality images uploaded for free by photographers that, in turn, were free to download by users, resulting in millions of visitors to the site. As they continue to innovate and find new ways to generate revenue, Unsplash proves that a solid service and a little creativity can yield dividends for years to come.</p>",63d2c4b249c21eb6b63a216d,Yes,https://imagedelivery.net/So76NP_fFT3s9jNLvxCRFw/5e859542-5eba-4f38-06b2-ab2f00437100/public,How Unsplash turned a side-of-desk hustle into a multi-layered business model—and what product teams can learn from the way it found its profit.,Unsplash: Disrupting the Stock Photo Industry,https://imagedelivery.net/So76NP_fFT3s9jNLvxCRFw/ebc4e59f-e7d8-48ef-41f4-c38349cadc00/public,,,unsplash-disrupting-the-stock-photo-industry,https://imagedelivery.net/So76NP_fFT3s9jNLvxCRFw/ebc4e59f-e7d8-48ef-41f4-c38349cadc00/public,Technology Development (https://app.notion.com/p/Technology-Development-37db37adcd5b810d82f1cd7038016629?pvs=21)
