Title,Status,Publish Date,Author,Categories,Excerpt,Featured,Legacy HTML,Legacy Webflow ID,Masthead Dark Overlay,Masthead Image,Meta Description,Meta Title,OG Image,Photo Credit,Related Articles,Slug,Thumbnail Image,Old Categories
Product Design Insights: Seven Great Reads for May,Draft,"May 12, 2020 5:00 PM (PDT)",J.P. Holecka (https://app.notion.com/p/J-P-Holecka-37db37adcd5b81fda1abff160a375857?pvs=21),Build,A curated selection of our team's recommended digital product reads.,No,"<p id="""">We’re back with another month of Product Design Insights. May features content about establishing a company-wide design mentality, a new partnership project between giant tech rivals, common problems clients have with digital agencies, and more. If you missed last month, find out what inspired our team in <a id="""" href=""/blog/product-design-insights-great-reads-for-april"">April</a>. Or, if you prefer to get these insights delivered to your inbox, <a id="""" href=""https://click.pstransmit.net/h/y/603EB429506F0841"">subscribe</a> to our Simply Good Reads newsletter! </p><h2 id="""">How can product managers reduce cognitive load to increase feature adoption?</h2><p id=""""><em id="""">Recommended by: Priscilla Ho, UX Lead</em></p><p id="""">Users are inundated with their choice of digital tools to automate and streamline everyday tasks. With the rapid pace of the changing technological landscape, companies are needing to evolve their products faster than ever before. But how do you introduce new features to an audience without overwhelming them? <a id="""" href=""https://www.mindtheproduct.com/how-can-product-managers-reduce-cognitive-load-to-increase-feature-adoption/"">This article</a> recommends reducing cognitive load by limiting the number of options available, grouping similar elements together, and using visuals to communicate complicated concepts. In other words, <a id="""" href=""/blog/simplicity-mandate-for-products""><em id="""">simplify</em></a> the process. </p><h2 id="""">Design systems are everybody’s business</h2><p id=""""><em id="""">Recommended by: JP Holecka, CEO, Founder, Product Strategist</em></p><p id="""">At POWER SHIFTER, we’re big on process. When a process is in place, everything is repeatable—which saves teams time, money, and stress. Having a design process is especially important when creating a product. Adopting a company-wide design mentality puts everyone on the same page. For our clients, we know that speed to market is crucial. So being able to minimize friction and increase efficiency is key. <a id="""" href=""https://www.designsystems.com/design-systems-are-everybodys-business/"">This article</a> walks readers through the five phases of building a design system. The focus is to empower people to create amazing experiences rather than prescribe a one-size fit all approach.</p><h2 id="""">Apple and google give devs a first look at their covid-19 tracking api</h2><p id=""""><em id="""">Recommended by: Trevor Westlund, Senior Business Development Director</em></p><p id=""""><a id="""" href=""https://www.engadget.com/apple-google-covid-19-api-dev-seed-170043718.html"">This marks</a> a huge step for Apple, who have vehemently rejected all tracking apps in the past. Some would say for good reason—as the world becomes increasingly globalized, we are confronted with examples of Orwellian surveillance. Others believe there is a place for these APIs as long as the right policies are put in place. As more information becomes available in the coming weeks, the big question to answer will be if consumers and the general public trust the program enough to see it successfully combat COVID-19. &nbsp;</p><h2 id="""">Agency vs. in-house team</h2><p id=""""><em id="""">Recommended by: JP Holecka, CEO, Founder, Product Strategist</em></p><p id="""">Whether its product design, mobile apps, websites, or marketing, companies hire agencies for myriad reasons. Many of which stem from the realization that their team lacks the necessary expertise, time, or culture to build the calibre of campaign or application needed. There are considerations to make when hiring an agency, but the benefits outweigh the perceived risks (if you’re working with the right agency). <a id="""" href=""https://www.gravitatedesign.com/blog/digital-marketing-company-vs-in-house-team/"">This article</a> answers the question, “should we hire and develop full-time employees, or do we need help from an agency?” from a marketing perspective. But if you’re looking for answers to this question with a focus on digital product design, you can find that <a id="""" href=""/blog/outsourcing-digital-product-design"">here</a>.</p><h2 id="""">37 business concepts every designer needs to know</h2><p id=""""><em id="""">Recommended by: Gord Brown, Senior Designer</em></p><p id="""">“If you just go into the room and narrowly think about ‘design, design, design,’ and if you don’t value the business or understand why you have to move to market quickly, your contribution will not be felt” - Kate Aronowitz, Designer Partner at Google Ventures. </p><p id="""">Business people are just humans, with a niche set of words and focused perspectives that designers have to understand to be able to speak on that level. Approaching any project with a mindset of simplicity and servitude, while being well-informed and able to connect at the business table, will see more success and credibility added to the designer and their team. <a id="""" href=""https://www.invisionapp.com/inside-design/business-concepts-for-designers/"">This article</a> outlines 37 business concepts that will help designers better align with their colleagues.</p><h2 id="""">The biggest problems clients have with digital agencies</h2><p id=""""><em id="""">Recommended by: JP Holecka, CEO, Founder, Product Strategist</em></p><p id="""">We have worked on hundreds of projects and have heard the same frustrations from clients about previous experiences with other agencies. Of the five problems listed in <a id="""" href=""https://clientflow.com/blog/the-biggest-problems-clients-have-with-digital-agencies/"">the article</a>, it's no surprise that communication is number one and ""not listening"" also makes the list. At POWER SHIFTER, we pride ourselves on leading with empathy. When we put ourselves in our clients' shoes, we can better understand what they need from us as a partner to make their project a success. (This is why our feature as a <a id="""" href=""/blog/clutch-top-agency-in-canada"">top agency</a> in Canada on Clutch for the second year in a row is especially important to us).</p><h2 id="""">Figma feature highlight: observation mode</h2><p id=""""><em id="""">Recommended by: Priscilla Ho, UX Lead</em></p><p id="""">As a digital studio, we stay on top of the latest technology trends, especially ones that make it easier to collaborate with each other and our clients. We believe wholeheartedly in transparency: no one should wonder what we’re working on. But <a id="""" href=""https://www.figma.com/blog/figma-feature-highlight-observation-mode/"">Figma’s Observation Mode</a> is not just an exciting way for clients to see progress; it can also handle user testing. We highly recommend Figma, but we’ll let you evaluate the product for yourself.</p>",63d2c4b249c21e490a3a2024,No,https://imagedelivery.net/So76NP_fFT3s9jNLvxCRFw/e6c6f723-97ca-454e-82d1-fddbd1045200/public,"May's reads: building a company-wide design mentality, an unlikely tech-giant partnership, common gripes with agencies, and more. Curated by our team.",Product Design Insights: 7 Great Reads for May,https://imagedelivery.net/So76NP_fFT3s9jNLvxCRFw/677e3f9a-a317-43f7-ca4f-5eacf043d600/public,,,product-design-insights-great-reads-for-may,https://imagedelivery.net/So76NP_fFT3s9jNLvxCRFw/677e3f9a-a317-43f7-ca4f-5eacf043d600/public,"Resources (https://app.notion.com/p/Resources-37db37adcd5b813ba75fe6bf61012e8a?pvs=21), Experience Design (https://app.notion.com/p/Experience-Design-37db37adcd5b8188ba20fc3f87aadc25?pvs=21)"
Webinar: Rethinking CX Needs in 2021,Published,"January 5, 2021 4:00 PM (PST)",J.P. Holecka (https://app.notion.com/p/J-P-Holecka-37db37adcd5b81fda1abff160a375857?pvs=21),Build,We'll show you how to apply Lean Service Design to your CX strategy this year.,No,"<p id="""">In a recent survey conducted by the National Center for the Middle Market, more than 80% of business leaders said they were likely to make significant and long-lasting changes in how they organized work and interacted with and served customers. </p><p id="""">COVID-19 created an urgency for businesses to rethink their Customer Experience (CX) needs. With so many organizations shifting to digital, there is pressure to test and validate how to deliver services in an evolving and competitive omnichannel landscape. </p><h3 id="""">In this webinar you will learn:</h3><ul id=""""><li id="""">How to change your customer touchpoints, work culture, thinking, and old habits to not only survive but thrive in 2021 and beyond. </li><li id="""">What Lean Service Design is and how it can help you achieve business outcomes.</li><li id="""">How to implement Lean Service Design in your organization. </li></ul><h3 id="""">Details</h3><ul id=""""><li id=""""><strong id="""">When:</strong> Wednesday, Februrary 3, 2021</li><li id=""""><strong id="""">Time:</strong> 10:00 AM PST/1:00 PM EST</li><li id=""""><strong id="""">Presenters:</strong> JP Holecka, Founder &amp; CEO and Priscilla Ho, UX lead</li></ul><figure id="""" class=""w-richtext-figure-type-image w-richtext-align-center"" data-rt-type=""image"" data-rt-align=""center""><div id=""""><img id="""" alt=""Presenters"" src=""https://uploads-ssl.webflow.com/62a638e43312dd558c19617f/62b39886d85a51328fb37adc_Presenters.png"" width=""auto"" height=""auto"" loading=""auto""></div></figure><h2 id="""">Save your seat</h2>",63d2c4b249c21e46d13a21dc,No,https://imagedelivery.net/So76NP_fFT3s9jNLvxCRFw/6bd955db-f19e-46af-c638-18064762e200/public,More than 80% of leaders planned lasting changes to how they serve customers. Our webinar on applying Lean Service Design to your 2021 CX strategy.,Webinar: Rethinking CX Needs in 2021,https://imagedelivery.net/So76NP_fFT3s9jNLvxCRFw/2993c376-af38-468e-8453-6a7bb6450c00/public,,,webinar-rethinking-cx-needs-during-covid-19-and-beyond,https://imagedelivery.net/So76NP_fFT3s9jNLvxCRFw/2993c376-af38-468e-8453-6a7bb6450c00/public,"Service Design (https://app.notion.com/p/Service-Design-37db37adcd5b8176b82ec23e2eeb4adc?pvs=21), Resources (https://app.notion.com/p/Resources-37db37adcd5b813ba75fe6bf61012e8a?pvs=21)"
Product Design Insights: Six Educational Reads for June,Draft,"June 18, 2020 5:00 PM (PDT)",J.P. Holecka (https://app.notion.com/p/J-P-Holecka-37db37adcd5b81fda1abff160a375857?pvs=21),Founder's Focus,A selection of articles our team recommends to learn about race and tech.,No,"<p id="""">As unrest has taken over North America and parts of the world, POWER SHIFTER has been looking inward at our policies and processes to uncover what we could be doing better or more of to increase equity for all. As we’ve been reading and educating ourselves, we wanted to share helpful articles, not to contribute to the noise, but to help those who may be on the same journey.</p><h3 id="""">Just a brown hand</h3><p id="""">In 2015, Slack unveiled a new feature that made it easier for developers to connect to the application. It wasn’t the feature itself that garnered attention, but the graphic Slack used to showcase the addition—a <a id="""" href=""https://medium.com/@uxdiogenes/just-a-brown-hand-313db35230c5"">brown hand</a>. The outpour of appreciation pointed to a big problem in tech and product design: companies have a “bad habit of portraying white people as the default, and everyone else as deviations from the norm.” The lesson? Representation matters.</p><h3 id="""">How to begin designing for diversity</h3><p id="""">As designers (and humans), we are only experts of our lived experience. This means, whether conscious or not, bias exists in design. To make the process more inclusive, Boyuan Gao and Jahan Mantin of Project Inkblot, created a framework to help companies circumvent their biases. <a id="""" href=""https://thecreativeindependent.com/guides/how-to-begin-designing-for-diversity/"">Design for Diversity</a> or D4D, is a methodology that can be layered onto existing processes and empowers teams to create equitable products, services, and content. </p><h3 id="""">GitHub replaces terminology with alternatives to avoid slavery references</h3><p id="""">Language matters. GitHub and a number of other companies and open source projects are <a id="""" href=""https://www.zdnet.com/article/github-to-replace-master-with-alternative-term-to-avoid-slavery-references/"">replacing racist terminology</a> found in source code, software applications, and online solutions in support of the Black community. Words like ""master"" and ""slave"" are being changed to ""main/default/primary,"" and common terms like ""blacklist"" and ""whitelist"" are being dropped for ""allow list"" and ""deny/exclude list."" Cleaning up problematic language is just a start, but it's a big move that we are hopeful will inspire change across all industries.</p><h3 id="""">So you want to talk about race in tech?</h3><p id="""">*“I have never faced more blatant accusations about my race, and whether it helps or hinders my career, than I have in tech. I’ve literally been asked to my face, ‘Do you think you got that promotion because you’re black?’” - Ijeoma Oluo, author of So You Want to Talk About Race. *</p><p id="""">This <a id="""" href=""https://techcrunch.com/2020/06/13/so-you-want-to-talk-about-race-in-tech-with-ijeoma-oluo/"">poignant article</a> details an interview with Ijeoma and provides an eye-opening account of the state of race and racism in tech spaces. Some might find this conversation challenging to digest, but as the author says, Ijeoma is sharing a vision that is the more optimistic alternative for how things could go in the coming years.</p><h3 id="""">Black Lives Matter brand responses</h3><p id="""">There has been an overwhelming number of responses by brands who have rushed to support and align with Black Lives Matter. <a id="""" href=""https://docs.google.com/presentation/d/19d2SDI4yEbkSyPnFqHNwcc7TAb_4PaVEza3FprS_2Nk/preview?pru=AAABctzNGo0*FxU-fpymANS7AcOKRfhMOA&slide=id.g8817a0a96d_1_7"">This resource</a> has recorded over 100 examples, highlighting their responses, their actions, and some reactions from the public. We share this presentation to learn more about what we, as a community, can do to make a real impact.</p><h3 id="""">Anti-racism &amp; educational resources</h3><p id="""">As an agency full of empathetic, curious, and passionate people, many internal questions were raised around what we could be doing to support Black Lives Matter. Eilish Kennedy, POWER SHIFTER’s Managing Director, compiled <a id="""" href=""https://docs.google.com/document/d/1cXcRPdkmaKia1GmRBM2dIyo115XzBubbaapWZNWtorE/edit"">a list</a> of books, movies, documentaries, podcasts, and accounts to follow on social media to educate ourselves and become allies. If you or your organization are looking for educational resources, this list is a great place to find the information that will help you along your journey.</p>",63d2c4b249c21e45293a2055,Yes,https://imagedelivery.net/So76NP_fFT3s9jNLvxCRFw/46bd0df3-f049-45b3-100f-b5259770df00/public,"Six articles our team is reading to learn about race and technology, and to examine how we can build more equitable products and processes.",Product Design Insights: 6 Reads on Race & Tech for June,https://imagedelivery.net/So76NP_fFT3s9jNLvxCRFw/59a56ecb-f739-480c-0049-8044c6a01e00/public,,,product-design-insights-great-reads-for-june,https://imagedelivery.net/So76NP_fFT3s9jNLvxCRFw/59a56ecb-f739-480c-0049-8044c6a01e00/public,"Resources (https://app.notion.com/p/Resources-37db37adcd5b813ba75fe6bf61012e8a?pvs=21), Experience Design (https://app.notion.com/p/Experience-Design-37db37adcd5b8188ba20fc3f87aadc25?pvs=21)"
Product Design Insights: Seven Great Reads for October,Draft,"October 19, 2020 5:00 PM (PDT)",J.P. Holecka (https://app.notion.com/p/J-P-Holecka-37db37adcd5b81fda1abff160a375857?pvs=21),Build,A curated selection of our team's recommended digital product reads.,No,"<p id="""">This month, our digital product experts have been reading about a new tool that simplifies custom app development, unlearning to learn design, ways to avoid cognitive biases, the latest COVID-19 innovation for grocery stores, and more. Happy learning!</p><h2 id="""">The business of getting work from ""to do"" to ""done""</h2><p id=""""><strong id="""">Category: Technology</strong></p><p id=""""><em id="""">Recommended by: JP Holecka, CEO, Founder, Product Strategist</em></p><p id="""">Asynchronous and remote work have increased out of necessity since the onset of the pandemic. For many organizations, this year has been their first experience communicating and collaborating with disparate staff. But even those more seasoned in virtual environments experience challenges. Atlassian created <a id="""" href=""https://www.atlassian.com/work-management"">The Workstream</a> to empower teams with the digital tools they need to build high-performing teams and get ahead of the competition. The Workstream offers guidelines and templates to help teams manage everything from strategic planning, resource planning, content management, automation, task management, and more.</p><h2 id="""">29 design tools &amp; websites you’ve (probably) never heard of</h2><p id=""""><strong id="""">Category: Design</strong></p><p id="""">*Recommended by: Gord Brown, Senior Designer *</p><p id="""">There are so many digital tools available for designers these days. From identifying brand colours and creating workflows and wireframes to designing websites and products and showing your portfolio with the world, there is an application for everything. <a id="""" href=""https://uxdesign.cc/29-of-my-favorite-websites-most-designers-have-never-heard-of-d7d99179cda7"">This article</a> features 29 resources that you may or may not have heard of to help you regardless of where you're at in your career or project phase. Our personal favorite at POWER SHIFTER, a tool we use a lot with internal and client projects, is Figma.</p><h2 id="""">Adobe’s project firefly simplifies custom app development</h2><p id=""""><strong id="""">Category: Technology</strong></p><p id=""""><em id="""">Recommended by: Brendan Betts, Software Developer</em></p><p id="""">Many businesses have pivoted to digital, creating an urgent need for accessible and functional online presences. To support organizations, Adobe recently launched a new set of tools that increase the speed and ease with which developers can build applications. Project Firefly is a complete framework that enables engineers to develop and deploy custom web apps in minutes on a serverless platform. <a id="""" href=""https://www.borndigital.com/2020/09/29/adobes-project-firefly-simplifies-custom-app-development"">This article</a> highlights some features of the new tool and why companies may find it useful as the emphasis on digital commerce skyrockets.</p><h2 id="""">Unlearning to learn design</h2><p id=""""><strong id="""">Category: Design</strong></p><p id=""""><em id="""">Recommended by: Gord Brown, Senior Designer</em></p><p id="""">In <a id="""" href=""https://uxdesign.cc/unlearning-to-learn-design-80b4e297462e"">this article</a>, author Tiffany Wong reflects on her career and how she was taught to design. Her biggest takeaway is that all designers, regardless of age and career stage, question how they have developed their design learning. Through this curiosity and desire to unlearn, “we reframe ourselves to learn with an equitable and inclusive lens right at the start. It is only then that we can truly understand how to open our eyes to more liberating and transformative possibilities of design.”</p><h2 id="""">Strapi announces a new draft and publish feature</h2><p id=""""><strong id="""">Category: Technology</strong></p><p id=""""><em id="""">Recommended by: Colton Buchanan, Software Developer</em></p><p id="""">Strapi is an open-source, fully customizable, headless CMS. We evaluated the platform for a recent client but went with another option because it was missing some critical functionalities—namely, draft, preview, and publish. In a <a id="""" href=""https://strapi.io/blog/announcing-a-new-draft-and-publish-feature"">recent announcement</a>, the company launched version 2.3 that includes draft &amp; publish features, templates, and more. Building products is an incremental process and knowing what to prioritize on the roadmap comes down to customer priorities. We love open-source technologies and will be keeping an eye on Strapi as it matures.</p><h2 id="""">Contactless checkout: why it's coming to the bodega before the chain store</h2><p id=""""><strong id="""">Category: Service Design</strong></p><p id=""""><em id="""">Recommended by: Priscilla Ho, Lead UX Designer</em></p><p id="""">Grocery stores have had to pivot quickly throughout the pandemic to meet ever-changing health recommendations and are now relying on technology to keep people safe. The most recent solution to arrive is <a id="""" href=""https://www.zdnet.com/article/contactless-checkout-why-its-coming-to-the-bodega-before-the-chain-store/"">contactless checkouts</a>. They minimize human interaction and are minimal in size, which means they don’t require major renovations to install. It is increasingly clear that society is shifting towards automation, and companies who can build products to keep up with the demands will make a high impact and reap the rewards.</p><h2 id="""">Design better by avoiding your cognitive biases</h2><p id=""""><strong id="""">Category: Design</strong></p><p id=""""><em id="""">Recommended by: Priscilla Ho, Lead UX Designer</em></p><p id="""">Everyone has cognitive biases. They are often an attempt for our brains to simplify information, making processing faster and more efficient. If we fail to consider our blindspots when designing a product or service, we may be negatively impacting our users. <a id="""" href=""https://www.kooslooijesteijn.net/blog/design-better-avoiding-cognitive-biases?/?ref=mobbin"">This article</a> discusses seven cognitive biases, how they affect design, and what you can do to avoid them. </p><p id=""""><em id="""">To get these insights delivered straight to your inbox, </em><a id="""" href=""https://click.pstransmit.net/h/y/603EB429506F0841""><em id="""">subscribe</em></a><em id=""""> to our Simply Good Reads newsletter!</em></p>",63d2c4b249c21e361d3a2041,No,https://imagedelivery.net/So76NP_fFT3s9jNLvxCRFw/e6c6f723-97ca-454e-82d1-fddbd1045200/public,"October's reads: a tool that simplifies custom app development, unlearning design habits, avoiding cognitive biases, and more. Curated by our team.",Product Design Insights: 7 Great Reads for October,https://imagedelivery.net/So76NP_fFT3s9jNLvxCRFw/677e3f9a-a317-43f7-ca4f-5eacf043d600/public,,,product-design-insights-great-reads-for-october,https://imagedelivery.net/So76NP_fFT3s9jNLvxCRFw/677e3f9a-a317-43f7-ca4f-5eacf043d600/public,"Resources (https://app.notion.com/p/Resources-37db37adcd5b813ba75fe6bf61012e8a?pvs=21), Experience Design (https://app.notion.com/p/Experience-Design-37db37adcd5b8188ba20fc3f87aadc25?pvs=21)"
