Title,Status,Publish Date,Author,Categories,Excerpt,Featured,Legacy HTML,Legacy Webflow ID,Masthead Dark Overlay,Masthead Image,Meta Description,Meta Title,OG Image,Photo Credit,Related Articles,Slug,Thumbnail Image,Old Categories
Why Composable Development Is the Foundation for Smarter AI Agents and Modern CMS,Published,"March 21, 2025 5:00 PM (PDT)",J.P. Holecka (https://app.notion.com/p/J-P-Holecka-37db37adcd5b81fda1abff160a375857?pvs=21),Build,"Composable systems aren’t just modular — they’re strategic. Learn how AI agents thrive with composable architecture, powering smarter decisions and scalable performance.",No,"<p id="""">If the past few years have taught us anything, it’s that agility wins. Whether you’re leading a digital product team or scaling a modern enterprise, being able to move fast, pivot hard, and plug in what you need when you need it isn’t just nice to have — it’s how you stay alive.</p><p id="""">This is where composable development comes in. It’s not just another architectural trend. It’s a mindset shift that reimagines how we build for change. And for AI agents, composability is quickly becoming the backbone of capability.</p><h3 id="""">From Static Systems to Self-Directed Agents</h3><p id="""">Traditional systems were built with assumptions. That data lived in one place. That integrations were hard-coded. That workflows rarely changed. But AI agents don’t work that way. They need context. They need agility. They need to act in real time.</p><p id="""">Composable development flips the old model on its head. With modular APIs, microservices, and headless systems, AI agents can pull the exact data they need—when they need it—from any system that follows modern rules.</p><p id="""">Imagine a retail AI agent rerouting a shipment. It calls the weather API, checks vendor SLAs, pulls regional stock from the ERP, and adjusts logistics on the fly. No manual handoffs. No brittle integrations. Just real-time orchestration powered by composable infrastructure.</p><h3 id="""">Why Composable Content Matters for Agents</h3><p id="""">Now here’s where things get interesting: when AI agents meet composable CMS platforms.</p><p id="""">Headless CMS platforms weren’t built just to separate content from presentation. They were designed for flexibility. And that flexibility is exactly what makes them valuable to AI.</p><p id="""">AI agents don’t just retrieve content. They interact with it. They personalize it. They translate it. They repackage it for different users and contexts. With composable CMS platforms, content becomes modular, metadata-rich, and easily queryable.</p><p id="""">Think about it like this: a headless CMS with vector database integration allows an AI agent to:<br>- Search semantically, not just by keyword<br>- Retrieve and remix modular content blocks in real-time<br>- Personalize across languages, devices, and user segments</p><p id="""">This isn’t some abstract vision. It’s happening. AI agents can now dynamically assemble email campaigns, landing pages, or even support responses using the same content components, recombined based on user behavior and intent.</p><h3 id="""">Real-Time Context Needs Real-Time Access</h3><p id="""">One of the most overlooked challenges in building intelligent systems is context. Agents don’t just need data—they need the right data, at the right moment, with the right permissions.</p><p id="""">Composable CMS platforms give us that. They allow AI agents to retrieve only what they need, scoped to user roles, device types, and regional rules. Combined with structured metadata, agents can assess not just what content exists, but when and how it should be used.</p><p id="""">This has huge implications for personalization at scale. Instead of hardcoding rules, agents can infer context and dynamically respond with the right mix of messaging, visuals, and offers.</p><h3 id="""">It’s Not Just About Flexibility. It’s About Velocity.</h3><p id="""">Composable architectures aren’t just flexible. They’re fast. Because when every piece is modular, versioned, and governed, agents don’t need to wait on monolithic release cycles. They can fetch, deploy, and act on content in real-time.</p><p id="""">It’s like going from waiting on a design team to localize a campaign to have your agent assemble, translate, and launch the localized version in under 60 seconds.</p><h3 id="""">Final Take: Agents Need More Than Intelligence. They Need Access.</h3><p id="""">The future of AI isn’t just about smarter models. It’s about smarter ecosystems.</p><p id="""">Composable CMS platforms give AI agents the raw material they need to act with intelligence. Composable development at large gives us a way to build systems that can keep up with the speed of decision-making.</p><p id="""">If you want agents that actually make a difference, not just chat, start by giving them something worth acting on. Composability is where that begins.</p><p id="""">‍</p>",67ded99713fb820982651dfe,Yes,https://imagedelivery.net/So76NP_fFT3s9jNLvxCRFw/a948eeac-e25e-4d9f-a5c9-7f5bb549c600/public,"Composable systems aren't just flexible—they're the foundation AI agents need for real-time access to structured, modular content and live data.",Why Composable Development Powers Smarter AI Agents,https://imagedelivery.net/So76NP_fFT3s9jNLvxCRFw/e5d16d28-90af-4360-f041-e6ef62836900/public,Generative AI (https://app.notion.com/p/Generative-AI-37db37adcd5b817e88ebdabf5b701823?pvs=21),"Chapter 10 - The Future of Headless CMS and What It Means for Your Business (https://app.notion.com/p/Chapter-10-The-Future-of-Headless-CMS-and-What-It-Means-for-Your-Business-37db37adcd5b81649e01eb556937d048?pvs=21), Everything’s Gone Headless — Is Your Organization Ready? (https://app.notion.com/p/Everything-s-Gone-Headless-Is-Your-Organization-Ready-37db37adcd5b81eaa3d2d45ee5d4817d?pvs=21)",composable-development-ai-agents,https://imagedelivery.net/So76NP_fFT3s9jNLvxCRFw/a948eeac-e25e-4d9f-a5c9-7f5bb549c600/public,"Artificial Intelligence (https://app.notion.com/p/Artificial-Intelligence-37db37adcd5b8100860fe4d32dc2d1ef?pvs=21), Experience Design (https://app.notion.com/p/Experience-Design-37db37adcd5b8188ba20fc3f87aadc25?pvs=21), Headless CMS (https://app.notion.com/p/Headless-CMS-37db37adcd5b814688f5d632a41432e4?pvs=21)"
"""The Brand Experience"" Podcast",Published,"August 13, 2024 5:00 PM (PDT)",J.P. Holecka (https://app.notion.com/p/J-P-Holecka-37db37adcd5b81fda1abff160a375857?pvs=21),Frames,"Discover the secrets to creating unforgettable brands with The Brand Experience, where innovative design, strategic service, and purpose-driven narratives converge to shape consumer perceptions. Each episode offers expert insights and real-world case studies on thriving in the Experience Economy.",No,"<h4 id="""">About ""The Brand Experience""</h4><p id="""">Dive into the depths of what makes a brand unforgettable with “The Brand Experience,” a podcast dedicated to exploring the ways in which innovative design, strategic service design, and purpose-driven brand narratives come together to shape consumer perceptions and experiences. Join us as we share the secrets behind creating exceptional brand experiences that captivate, engage, and retain. Each episode features in-depth discussions, expert analysis, and real-world case studies showcasing how brands can thrive in the Experience Economy.</p><p id=""""><strong id="""">Subscribe to </strong><strong id="""">""The Brand Experience,""</strong> <a id="""" href=""https://thebrandexperience.podbean.com/"" target=""_blank"">Podcast</a><strong id=""""> and </strong><a id="""" href=""https://www.youtube.com/@The_Brand_Experience"" target=""_blank"">YouTube channel </a><strong id="""">to get notified when new episodes drop.</strong></p><p id="""">‍</p><h4 id="""">Episode 2 - Unlock the Secrets of Product Design &amp; Brand Experience with Katie Deloso</h4><figure id="""" class=""w-richtext-figure-type-video w-richtext-align-center"" style=""padding-bottom:33.723653395784545%"" data-rt-type=""video"" data-rt-align=""center"" data-rt-max-width="""" data-rt-max-height=""33.723653395784545%"" data-rt-dimensions=""854:480"" data-page-url=""https://youtu.be/b3fPtr7Uy6M?si=zfyoOZLZviodBvG5""><div id=""""><iframe src=""https://www.youtube.com/embed/b3fPtr7Uy6M"" title=""Unlock the Secrets of Product Design & Brand Experience"" scrolling=""no"" frameborder=""0"" allowfullscreen=""true""></iframe></div></figure><div data-rt-embed-type='true'><iframe title=""Unlock the Secrets of Product Design & Brand Experience"" allowtransparency=""true"" height=""150"" width=""100%"" style=""border: none; min-width: min(100%, 430px);height:150px;"" scrolling=""no"" data-name=""pb-iframe-player"" src=""https://www.podbean.com/player-v2/?from=embed&i=4zdzg-16a38c9-pb&share=1&download=0&fonts=Arial&skin=3267a3&font-color=auto&rtl=0&logo_link=podcast_page&btn-skin=7&size=150"" loading=""lazy""></iframe></div><p id="""">Join host JP Holecka in this exciting episode of “The Brand Experience” as he interviews industry expert Katie Deloso. Discover how top brands excel in digital product design and brand experience. Learn from Katie’s journey as a product designer and her unique approach to storytelling through case studies and product stories. Get insights into the intersection of product design, brand experience, and behavioural science that drive customer engagement and retention. Whether you’re a seasoned marketer or just starting, this video will provide you with actionable strategies to enhance your brand’s digital presence.</p><p id="""">‍</p><h4 id="""">Episode 1 - Embracing the Experience Economy with ""Howie"" Howatson</h4><figure id="""" class=""w-richtext-figure-type-video w-richtext-align-center"" style=""padding-bottom:33.723653395784545%"" data-rt-type=""video"" data-rt-align=""center"" data-rt-max-width="""" data-rt-max-height=""33.723653395784545%"" data-rt-dimensions=""854:480"" data-page-url=""https://youtu.be/qoQSk1Nr7YI?si=gsp4Crevh2RZ8vZy""><div id=""""><iframe src=""https://www.youtube.com/embed/qoQSk1Nr7YI"" title=""Designing Delight: The Future of Digital Brand Experience"" scrolling=""no"" frameborder=""0"" allowfullscreen=""true""></iframe></div></figure><div data-rt-embed-type='true'><iframe title=""Designing Delight: The Future of Digital Brand Experience"" allowtransparency=""true"" height=""150"" width=""100%"" style=""border: none; min-width: min(100%, 430px);height:150px;"" scrolling=""no"" data-name=""pb-iframe-player"" src=""https://www.podbean.com/player-v2/?from=embed&i=fsgnz-16a213c-pb&share=1&download=0&fonts=Arial&skin=3267a3&font-color=auto&rtl=0&logo_link=podcast_page&btn-skin=7&size=150"" loading=""lazy""></iframe></div><p id="""">Join host JP Holecka as he interviews industry expert Howie Howatson in this episode of “The Brand Experience.” Discover Howie’s incredible journey from being a Disney-trained animator to becoming a leader in the digital product space. Learn about the evolution of brand experience, the importance of service design, and how digital transformation impacts customer interactions. Whether you’re a seasoned marketer or just starting, this video will provide you with actionable insights to enhance your brand’s digital touchpoints and ensure customer satisfaction.</p>",66ba618221207a571cb2c680,Yes,https://imagedelivery.net/So76NP_fFT3s9jNLvxCRFw/6f7d5c68-552a-4cda-eae8-e31b609f9c00/public,"A podcast on what makes brands stick—where design, service, and purpose-driven storytelling meet. Conversations with the people shaping them.",The Brand Experience Podcast,https://imagedelivery.net/So76NP_fFT3s9jNLvxCRFw/8bc54376-c6bc-4380-9f2f-4c01b70e4a00/public,,"""The Brand Experience"" YouTube Channel and Podcast - A Modern Approach to Brand Strategy and Digital Innovation (https://app.notion.com/p/The-Brand-Experience-YouTube-Channel-and-Podcast-A-Modern-Approach-to-Brand-Strategy-and-Digital--37db37adcd5b81cd8d44f0d35eb76642?pvs=21)",the-brand-experience-podcast,https://imagedelivery.net/So76NP_fFT3s9jNLvxCRFw/8bc54376-c6bc-4380-9f2f-4c01b70e4a00/public,Experience Design (https://app.notion.com/p/Experience-Design-37db37adcd5b8188ba20fc3f87aadc25?pvs=21)
Top 10 Mistakes People Make When Moving to a Headless CMS & A Comprehensive Guide To Avoiding Them,Published,"May 1, 2024 5:00 PM (PDT)",J.P. Holecka (https://app.notion.com/p/J-P-Holecka-37db37adcd5b81fda1abff160a375857?pvs=21),Build,Unlock the secrets to a flawless headless CMS transition with our free eBook: 'Top 10 Mistakes People Make When Moving to a Headless CMS and How to Avoid Them.' Download now and lead your digital transformation with confidence!,No,"<h3 id="""">Unlock the Potential of Headless Content Management Systems.</h3><p id="""">Are you ready to shift how you manage your content &amp; ensure your digital presence is as dynamic as your business? POWER SHIFTER Digital, with over eight years of expertise and more than 75 successful headless CMS projects, introduces an essential resource for CIOs, CTOs, CMOs and others looking to implement a headless CMS: our exclusive eBook, ""Top 10 Mistakes People Make When Moving to a Headless CMS &amp; a Comprehensive Guide To Avoiding Them.""</p><figure id="""" class=""w-richtext-figure-type-image w-richtext-align-fullwidth"" style=""max-width:1280px"" data-rt-type=""image"" data-rt-align=""fullwidth"" data-rt-max-width=""1280px""><a id="""" href=""#ebook"" target=""_blank""><div id=""""><img id="""" alt=""__wf_reserved_inherit"" src=""https://uploads-ssl.webflow.com/62a638e43312dd558c19617f/66c75edf3cddc419997ba011_66c75eb3ac1dce4aa7db0156_663279e947c61b40f9e5d33b_Headless%2520ebook%2520Banner%2520.png"" width=""auto"" height=""auto"" loading=""auto""></div></a></figure><h3 id="""">Why Headless CMS?</h3><p id="""">A headless CMS separates the backend content management from the frontend presentation, allowing unparalleled flexibility across diverse platforms—from websites &amp; apps to smart devices &amp; wearables. This modern approach addresses the limitations of traditional CMSs by enhancing scalability, performance, and security, making it the perfect choice for businesses aiming for a robust digital ecosystem.</p><h3 id="""">What You Will Gain</h3><p id="""">By downloading our eBook, you will access a wealth of knowledge that prepares you to:</p><ul id=""""><li id=""""><strong id="""">Navigate Technical Complexities:</strong> With detailed comparisons of headless versus traditional CMSs, you can make informed decisions that align with your business needs.</li><li id=""""><strong id="""">Optimize Content Delivery:</strong> Learn how to model &amp; structure your content for maximum impact across all digital touchpoints.</li><li id=""""><strong id="""">Avoid Costly Mistakes:</strong> From integration mishaps to data migration errors, our guide covers strategic planning to avoid common pitfalls affecting your project's success.</li></ul><h3 id="""">Common Pitfalls to Avoid</h3><p id="""">Transitioning to a headless CMS can be challenging. Our eBook delves into the common mistakes that can derail your digital transformation:</p><ul id=""""><li id=""""><strong id="""">Underestimating the Learning Curve:</strong> A shift to headless CMS requires new skills &amp; a strategic mindset. Our guide prepares your team for this shift, ensuring a smooth transition.</li><li id=""""><strong id="""">Poor Integration Planning:</strong> Discover how to seamlessly integrate your headless CMS with existing platforms &amp; systems to enhance functionality &amp; user experience.</li><li id=""""><strong id="""">Neglecting SEO &amp; Content Strategy:</strong> Learn to maintain and enhance your SEO positioning to ensure your content reaches its target audience effectively.</li></ul><h3 id="""">Exclusive Offer for Future Innovators</h3><p id="""">Join the ranks of forward-thinking leaders who are reshaping the digital landscape. Download your free copy today &amp; start transforming your content management strategy with confidence.</p><h3 id="""">Download Now: The Guide to Mastering Headless CMS</h3><p id="""">Don’t miss out on the opportunity to enhance your digital strategy. Enter your name and business email to get instant access to this critical resource and begin your journey toward digital excellence with POWER SHIFTER Digital.</p><div data-rt-embed-type='true'><div id=""ebook""><div></div></div></div><p id="""">‍</p><h3 id="""">Unlock Your Digital Future</h3><figure id="""" class=""w-richtext-figure-type-image w-richtext-align-floatleft"" style=""max-width:40%"" data-rt-type=""image"" data-rt-align=""floatleft"" data-rt-max-width=""40%""><div id=""""><img id="""" alt=""__wf_reserved_decorative"" src=""https://uploads-ssl.webflow.com/62a638e43312dd558c19617f/66c760098835e3f4bbc62210_661ee6525f05ca2f9d8d2ab0_1713301030.jpeg"" width=""auto"" height=""auto"" loading=""auto""></div></figure><p id="""">Your next step? Dive into the wealth of knowledge that awaits in ""Top 10 Mistakes People Make When Moving to a Headless CMS and a Comprehensive Guide to To Avoiding Them"" and start your transformation with POWER SHIFTER Digital, where innovation meets expertise.</p><p id="""">‍</p>",66314f0cf242ae6d529bc500,No,https://imagedelivery.net/So76NP_fFT3s9jNLvxCRFw/5026aefd-9107-44cf-57df-6d44dcb54800/public,Our free eBook on the ten most common headless CMS mistakes—and how to avoid them. Drawn from 75+ headless projects and eight years of experience.,Top 10 Mistakes When Moving to a Headless CMS,https://imagedelivery.net/So76NP_fFT3s9jNLvxCRFw/99dee77a-7cb6-47c2-d6b1-b10764e34e00/public,JP Holecka (https://app.notion.com/p/JP-Holecka-37db37adcd5b8109a480fddfa11fde30?pvs=21),"Everything’s Gone Headless — Is Your Organization Ready? (https://app.notion.com/p/Everything-s-Gone-Headless-Is-Your-Organization-Ready-37db37adcd5b81eaa3d2d45ee5d4817d?pvs=21), A Crash Course in Agile Product Design from Leading EdTech Experts (https://app.notion.com/p/A-Crash-Course-in-Agile-Product-Design-from-Leading-EdTech-Experts-37db37adcd5b81b1b2bde7337c5b8e47?pvs=21)",headless-cms-help-ebook,https://imagedelivery.net/So76NP_fFT3s9jNLvxCRFw/b8e435fd-720c-4976-8125-390efeb6b900/public,"Experience Design (https://app.notion.com/p/Experience-Design-37db37adcd5b8188ba20fc3f87aadc25?pvs=21), Technology Development (https://app.notion.com/p/Technology-Development-37db37adcd5b810d82f1cd7038016629?pvs=21), Headless CMS (https://app.notion.com/p/Headless-CMS-37db37adcd5b814688f5d632a41432e4?pvs=21)"
